{
  "$schema": "https://json-schema.org/draft/2020-12/schema",
  "$id": "https://hdip.dev/schemas/credentials/credential-record.schema.json",
  "title": "CredentialRecord",
  "type": "object",
  "additionalProperties": false,
  "required": [
    "credentialId",
    "issuerId",
    "templateId",
    "subjectReference",
    "claims",
    "artifactDigest",
    "status",
    "statusReference",
    "issuedAt",
    "expiresAt",
    "statusUpdatedAt"
  ],
  "properties": {
    "credentialId": {
      "type": "string",
      "minLength": 1
    },
    "issuerId": {
      "type": "string",
      "minLength": 1
    },
    "templateId": {
      "type": "string",
      "minLength": 1
    },
    "subjectReference": {
      "type": "string",
      "minLength": 1
    },
    "claims": {
      "type": "object",
      "additionalProperties": false,
      "required": [
        "fullLegalName",
        "dateOfBirth",
        "countryOfResidence",
        "documentCountry",
        "kycLevel",
        "verifiedAt",
        "expiresAt"
      ],
      "properties": {
        "fullLegalName": {
          "type": "string",
          "minLength": 1
        },
        "dateOfBirth": {
          "type": "string",
          "format": "date"
        },
        "countryOfResidence": {
          "type": "string",
          "pattern": "^[A-Z]{2}$"
        },
        "documentCountry": {
          "type": "string",
          "pattern": "^[A-Z]{2}$"
        },
        "kycLevel": {
          "type": "string",
          "minLength": 1
        },
        "verifiedAt": {
          "type": "string",
          "format": "date-time"
        },
        "expiresAt": {
          "type": "string",
          "format": "date-time"
        }
      }
    },
    "artifactDigest": {
      "type": "string",
      "pattern": "^[a-f0-9]{64}$"
    },
    "status": {
      "type": "string",
      "enum": [
        "active",
        "revoked",
        "superseded"
      ]
    },
    "statusReference": {
      "type": "string",
      "minLength": 1
    },
    "issuedAt": {
      "type": "string",
      "format": "date-time"
    },
    "expiresAt": {
      "type": "string",
      "format": "date-time"
    },
    "statusUpdatedAt": {
      "type": "string",
      "format": "date-time"
    },
    "supersededByCredentialId": {
      "type": "string",
      "minLength": 1
    },
    "signedCredential": {
      "type": "object",
      "additionalProperties": false,
      "required": [
        "format",
        "mediaType",
        "value"
      ],
      "properties": {
        "format": {
          "type": "string",
          "const": "sd_jwt_vc"
        },
        "mediaType": {
          "type": "string",
          "const": "application/vc+sd-jwt"
        },
        "value": {
          "type": "string",
          "minLength": 1
        }
      }
    },
    "artifactReference": {
      "type": "string",
      "minLength": 1
    }
  },
  "oneOf": [
    {
      "required": [
        "signedCredential"
      ],
      "properties": {
        "signedCredential": {
          "type": "object"
        },
        "artifactReference": false
      }
    },
    {
      "required": [
        "artifactReference"
      ],
      "properties": {
        "artifactReference": {
          "type": "string"
        },
        "signedCredential": false
      }
    }
  ]
}
