{
  "credentialId": "cred_hdip_passport_basic_001",
  "issuerId": "did:web:issuer.hdip.dev",
  "templateId": "hdip-passport-basic",
  "subjectReference": "subject_ref_alex_example",
  "claims": {
    "fullLegalName": "Alex Example",
    "dateOfBirth": "1990-01-01",
    "countryOfResidence": "MA",
    "documentCountry": "MA",
    "kycLevel": "basic",
    "verifiedAt": "2026-04-20T09:00:00Z",
    "expiresAt": "2027-04-20T09:00:00Z"
  },
  "artifactDigest": "3a3d9fbf43cf1769b1485596ddc44f4d2d9df7f47f5f70b9771af35fb0dcb2ef",
  "status": "active",
  "statusReference": "status:cred_hdip_passport_basic_001",
  "issuedAt": "2026-04-20T09:00:00Z",
  "expiresAt": "2027-04-20T09:00:00Z",
  "statusUpdatedAt": "2026-04-20T09:00:00Z",
  "signedCredential": {
    "format": "sd_jwt_vc",
    "mediaType": "application/vc+sd-jwt",
    "value": "eyJhbGciOiJFUzI1NiJ9.placeholder.credential"
  }
}
